config.json

{
  "baseFares": {
    "1-1-Peak": 2.50,
    "1-2-Peak": 3.20,
    "1-3-Peak": 3.80,
    "1-4-Peak": 4.40,
    "1-5-Peak": 5.00,

    "2-1-Peak": 3.20,
    "2-2-Peak": 2.30,
    "2-3-Peak": 3.10,
    "2-4-Peak": 3.80,
    "2-5-Peak": 4.50,

    "3-1-Peak": 3.80,
    "3-2-Peak": 3.10,
    "3-3-Peak": 2.10,
    "3-4-Peak": 3.00,
    "3-5-Peak": 3.70,

    "4-1-Peak": 4.40,
    "4-2-Peak": 3.80,
    "4-3-Peak": 3.00,
    "4-4-Peak": 2.00,
    "4-5-Peak": 2.90,

    "5-1-Peak": 5.00,
    "5-2-Peak": 4.50,
    "5-3-Peak": 3.70,
    "5-4-Peak": 2.90,
    "5-5-Peak": 1.90,

    "1-1-Off-Peak": 2.00,
    "1-2-Off-Peak": 2.70,
    "1-3-Off-Peak": 3.20,
    "1-4-Off-Peak": 3.70,
    "1-5-Off-Peak": 4.20,

    "2-1-Off-Peak": 2.70,
    "2-2-Off-Peak": 1.90,
    "2-3-Off-Peak": 2.60,
    "2-4-Off-Peak": 3.20,
    "2-5-Off-Peak": 3.80,

    "3-1-Off-Peak": 3.20,
    "3-2-Off-Peak": 2.60,
    "3-3-Off-Peak": 1.70,
    "3-4-Off-Peak": 2.50,
    "3-5-Off-Peak": 3.10,

    "4-1-Off-Peak": 3.70,
    "4-2-Off-Peak": 3.20,
    "4-3-Off-Peak": 2.50,
    "4-4-Off-Peak": 1.60,
    "4-5-Off-Peak": 2.40,

    "5-1-Off-Peak": 4.20,
    "5-2-Off-Peak": 3.80,
    "5-3-Off-Peak": 3.10,
    "5-4-Off-Peak": 2.40,
    "5-5-Off-Peak": 1.50
  },
  "passengerDiscounts": {
    "Adult": 0.00,
    "Student": 0.25,
    "Child": 0.50,
    "Senior Citizen": 0.30
  },
  "dailyCaps": {
    "Adult": 8.00,
    "Student": 6.00,
    "Child": 4.00,
    "Senior Citizen": 7.00
  },
  "peakWindows": [
    "06:30-09:30",
    "16:00-19:00"
  ],
  "adminPassword": "admin123"
}

4113 Part 2 - Milestone 2.md

### Program Code

System.out.print("Enter daily cap (example 8.00): ");  
                    capText = input.nextLine();  
                    while (!inputValidator.isPositiveDecimal(capText)) {  
                        System.out.println("Invalid daily cap.");  
                        System.out.print("Enter daily cap (example 8.00): ");  
                        capText = input.nextLine();  
                    }

System.out.print("Enter fare amount (example 3.20): ");  
                    fareText = input.nextLine();  
                    while (!inputValidator.isPositiveDecimal(fareText)) {  
                        System.out.println("Invalid fare.");  
                        System.out.print("Enter fare amount (example 3.20): ");  
                        fareText = input.nextLine();  
                    }

dailyCaps.put("Adult", new BigDecimal("8.00"));  
dailyCaps.put("Student", new BigDecimal("6.00"));  
dailyCaps.put("Child", new BigDecimal("4.00"));  
dailyCaps.put("Senior Citizen", new BigDecimal("7.00"));

// Peak fares  
put(m,1,1,TimeBand.PEAK,"2.50"); put(m,1,2,TimeBand.PEAK,"3.20");  
put(m,1,3,TimeBand.PEAK,"3.80"); put(m,1,4,TimeBand.PEAK,"4.40");  
put(m,1,5,TimeBand.PEAK,"5.00");

put(m,2,1,TimeBand.PEAK,"3.20"); put(m,2,2,TimeBand.PEAK,"2.30");  
put(m,2,3,TimeBand.PEAK,"3.10"); put(m,2,4,TimeBand.PEAK,"3.80");  
put(m,2,5,TimeBand.PEAK,"4.50");

put(m,3,1,TimeBand.PEAK,"3.80"); put(m,3,2,TimeBand.PEAK,"3.10");  
put(m,3,3,TimeBand.PEAK,"2.10"); put(m,3,4,TimeBand.PEAK,"3.00");  
put(m,3,5,TimeBand.PEAK,"3.70");

put(m,4,1,TimeBand.PEAK,"4.40"); put(m,4,2,TimeBand.PEAK,"3.80");  
put(m,4,3,TimeBand.PEAK,"3.00"); put(m,4,4,TimeBand.PEAK,"2.00");  
put(m,4,5,TimeBand.PEAK,"2.90");

put(m,5,1,TimeBand.PEAK,"5.00"); put(m,5,2,TimeBand.PEAK,"4.50");  
put(m,5,3,TimeBand.PEAK,"3.70"); put(m,5,4,TimeBand.PEAK,"2.90");  
put(m,5,5,TimeBand.PEAK,"1.90");

// Off-peak fares  
put(m,1,1,TimeBand.OFF_PEAK,"2.00"); put(m,1,2,TimeBand.OFF_PEAK,"2.70");  
put(m,1,3,TimeBand.OFF_PEAK,"3.20"); put(m,1,4,TimeBand.OFF_PEAK,"3.70");  
put(m,1,5,TimeBand.OFF_PEAK,"4.20");

put(m,2,1,TimeBand.OFF_PEAK,"2.70"); put(m,2,2,TimeBand.OFF_PEAK,"1.90");  
put(m,2,3,TimeBand.OFF_PEAK,"2.60"); put(m,2,4,TimeBand.OFF_PEAK,"3.20");  
put(m,2,5,TimeBand.OFF_PEAK,"3.80");

put(m,3,1,TimeBand.OFF_PEAK,"3.20"); put(m,3,2,TimeBand.OFF_PEAK,"2.60");  
put(m,3,3,TimeBand.OFF_PEAK,"1.70"); put(m,3,4,TimeBand.OFF_PEAK,"2.50");  
put(m,3,5,TimeBand.OFF_PEAK,"3.10");

put(m,4,1,TimeBand.OFF_PEAK,"3.70"); put(m,4,2,TimeBand.OFF_PEAK,"3.20");  
put(m,4,3,TimeBand.OFF_PEAK,"2.50"); put(m,4,4,TimeBand.OFF_PEAK,"1.60");  
put(m,4,5,TimeBand.OFF_PEAK,"2.40");

put(m,5,1,TimeBand.OFF_PEAK,"4.20"); put(m,5,2,TimeBand.OFF_PEAK,"3.80");  
put(m,5,3,TimeBand.OFF_PEAK,"3.10"); put(m,5,4,TimeBand.OFF_PEAK,"2.40");  
put(m,5,5,TimeBand.OFF_PEAK,"1.50");